{
  "schema_version": "0.1",
  "generated_at": "2026-06-01T11:16:17.101877Z",
  "source_artifacts": {
    "evidence_package": "/Users/kangmin/Documents/excel-workbook-editing/review-packages/workbook-understanding/mbp-2026-02-evidence-package.json",
    "document_ontology_mapping": "/Users/kangmin/Documents/excel-workbook-editing/review-packages/workbook-understanding/mbp-2026-02-document-ontology-mapping.json",
    "action_contracts": "/Users/kangmin/Documents/excel-workbook-editing/review-packages/workbook-understanding/mbp-2026-02-action-contracts.json",
    "general_domain_root": "/Users/kangmin/.onto/domains/accounting-kr",
    "local_domain_root": null
  },
  "method": {
    "name": "deterministic_domain_source_model",
    "authority": "domain_source_inventory_not_semantic_claim_generation",
    "decision_policy": "Represent reusable general-domain sources and boundary-scoped local-domain sources separately before semantic ontology proposal generation. Domain sources can constrain proposals but cannot replace workbook evidence."
  },
  "domain_layers": {
    "general_domain_sources": [
      {
        "id": "general_domain:accounting-kr/competency_qs.md",
        "layer": "general_domain",
        "domain_id": "accounting-kr",
        "document_role": "competency_question_set",
        "path": "/Users/kangmin/.onto/domains/accounting-kr/competency_qs.md",
        "file_name": "competency_qs.md",
        "status": "available",
        "scope": "current_sample_workbook",
        "applicability": "reusable_general_domain_constraint",
        "size_bytes": 41715,
        "sha256": "bdde4f0fdcc2cce632a164279f46f903f6b70b8d9c82d2a01f276d86139b3cdb",
        "heading_samples": [
          "# accounting-korea Domain — 역량 질문",
          "## 1. 회계의 기본 원칙 (최우선)",
          "### 1.1 복식부기 균형 검증",
          "### 1.2 발생기준 vs 현금기준 판단",
          "### 1.3 자산·부채·수익·비용 인식 요건",
          "### 1.4 기간 귀속 판단 (선수/미수/선급/미지급)",
          "### 1.5 수정분개 필요 여부 판단",
          "### 1.6 계속기업 전제 검증"
        ],
        "evidence_refs": [
          "general_domain:accounting-kr/competency_qs.md"
        ]
      },
      {
        "id": "general_domain:accounting-kr/concepts.md",
        "layer": "general_domain",
        "domain_id": "accounting-kr",
        "document_role": "concept_dictionary",
        "path": "/Users/kangmin/.onto/domains/accounting-kr/concepts.md",
        "file_name": "concepts.md",
        "status": "available",
        "scope": "current_sample_workbook",
        "applicability": "reusable_general_domain_constraint",
        "size_bytes": 20135,
        "sha256": "466811b2c94eabc2b12afbc331ef839d7f7c5bc07a2f522a7958b1f24144a5bd",
        "heading_samples": [
          "# accounting-korea Domain — 개념 사전 및 해석 규칙",
          "## 회계의 기본 원칙 (K-IFRS/K-GAAP 공통)",
          "### 개념체계 (Conceptual Framework)",
          "### 복식부기 원리 (Double-Entry Bookkeeping)",
          "### 재무제표 5요소의 정의와 인식",
          "### 측정 기준 (Measurement Bases)",
          "### 기본 회계 원칙",
          "### 회계 순환 과정 (Accounting Cycle)"
        ],
        "evidence_refs": [
          "general_domain:accounting-kr/concepts.md"
        ]
      },
      {
        "id": "general_domain:accounting-kr/conciseness_rules.md",
        "layer": "general_domain",
        "domain_id": "accounting-kr",
        "document_role": "concept_economy_rule_set",
        "path": "/Users/kangmin/.onto/domains/accounting-kr/conciseness_rules.md",
        "file_name": "conciseness_rules.md",
        "status": "available",
        "scope": "current_sample_workbook",
        "applicability": "reusable_general_domain_constraint",
        "size_bytes": 8045,
        "sha256": "bebc5a1f9a57f34620cbcdf3ca3268cad0e634d6262e846d8e7d91984508289c",
        "heading_samples": [
          "# accounting-korea Domain — 간결성 규칙",
          "## 1. 허용되는 중복",
          "### 회계-세무 이중 추적",
          "### 증빙 체계 중복",
          "### 재무제표 간 교차 참조",
          "### K-IFRS/K-GAAP 이원 체계",
          "## 2. 제거 대상 패턴",
          "### 기준 적용 중복"
        ],
        "evidence_refs": [
          "general_domain:accounting-kr/conciseness_rules.md"
        ]
      },
      {
        "id": "general_domain:accounting-kr/dependency_rules.md",
        "layer": "general_domain",
        "domain_id": "accounting-kr",
        "document_role": "dependency_rule_set",
        "path": "/Users/kangmin/.onto/domains/accounting-kr/dependency_rules.md",
        "file_name": "dependency_rules.md",
        "status": "available",
        "scope": "current_sample_workbook",
        "applicability": "reusable_general_domain_constraint",
        "size_bytes": 9167,
        "sha256": "941fd14ec37cbef4463c4327d2200d09392c10775121a2d09c236ae1b82e470b",
        "heading_samples": [
          "# accounting-korea Domain — 의존성 규칙",
          "## 재무제표 간 연결",
          "## 회계-세무 간 연결",
          "## 원천세-회계 간 연결",
          "## 부가세-회계 간 연결",
          "## 기준 간 의존",
          "## 기간 의존",
          "## 참조 무결성"
        ],
        "evidence_refs": [
          "general_domain:accounting-kr/dependency_rules.md"
        ]
      },
      {
        "id": "general_domain:accounting-kr/domain_scope.md",
        "layer": "general_domain",
        "domain_id": "accounting-kr",
        "document_role": "scope_definition",
        "path": "/Users/kangmin/.onto/domains/accounting-kr/domain_scope.md",
        "file_name": "domain_scope.md",
        "status": "available",
        "scope": "current_sample_workbook",
        "applicability": "reusable_general_domain_constraint",
        "size_bytes": 12612,
        "sha256": "c60daa66568b2e36137ccdc995902a7bf28277a5379645fae3b1e288418661b2",
        "heading_samples": [
          "# accounting-korea Domain — Domain Scope Definition",
          "## 주요 하위 영역",
          "### 회계기준 이원 체계",
          "### K-IFRS 핵심 기준서",
          "### 세무 회계",
          "### 감사·내부통제",
          "### 전자공시·신고",
          "### 지원 영역"
        ],
        "evidence_refs": [
          "general_domain:accounting-kr/domain_scope.md"
        ]
      },
      {
        "id": "general_domain:accounting-kr/extension_cases.md",
        "layer": "general_domain",
        "domain_id": "accounting-kr",
        "document_role": "extension_case_set",
        "path": "/Users/kangmin/.onto/domains/accounting-kr/extension_cases.md",
        "file_name": "extension_cases.md",
        "status": "available",
        "scope": "current_sample_workbook",
        "applicability": "reusable_general_domain_constraint",
        "size_bytes": 27598,
        "sha256": "3ae44780f3d359b0626bb5061fb38f174eca638e6904b43101c45fdcfd03409f",
        "heading_samples": [
          "# accounting-korea Domain -- 확장 시나리오",
          "## Case 1: K-GAAP -> K-IFRS 전환 (IPO 준비)",
          "### 상황 설명",
          "### K-IFRS/K-GAAP 공통 영향",
          "### 검증 항목",
          "### 영향 파일",
          "## Case 2: K-IFRS 기준서 개정",
          "### 상황 설명"
        ],
        "evidence_refs": [
          "general_domain:accounting-kr/extension_cases.md"
        ]
      },
      {
        "id": "general_domain:accounting-kr/logic_rules.md",
        "layer": "general_domain",
        "domain_id": "accounting-kr",
        "document_role": "logic_rule_set",
        "path": "/Users/kangmin/.onto/domains/accounting-kr/logic_rules.md",
        "file_name": "logic_rules.md",
        "status": "available",
        "scope": "current_sample_workbook",
        "applicability": "reusable_general_domain_constraint",
        "size_bytes": 15672,
        "sha256": "71eb6be9f0dc6ea64de098f33786c27cb2482328fa74c991e100965da9f70fa2",
        "heading_samples": [
          "# accounting-korea Domain — 로직 규칙",
          "## 회계의 기본 로직 (K-IFRS/K-GAAP 공통)",
          "### 복식부기 균형 로직",
          "### 인식 로직 (Recognition Logic)",
          "### 측정 로직 (Measurement Logic)",
          "### 기간 귀속 로직 (Period Allocation Logic)",
          "### 마감 로직 (Closing Logic)",
          "### 오류 수정 로직"
        ],
        "evidence_refs": [
          "general_domain:accounting-kr/logic_rules.md"
        ]
      },
      {
        "id": "general_domain:accounting-kr/structure_spec.md",
        "layer": "general_domain",
        "domain_id": "accounting-kr",
        "document_role": "structure_specification",
        "path": "/Users/kangmin/.onto/domains/accounting-kr/structure_spec.md",
        "file_name": "structure_spec.md",
        "status": "available",
        "scope": "current_sample_workbook",
        "applicability": "reusable_general_domain_constraint",
        "size_bytes": 6453,
        "sha256": "f36510bb9e233b148b54b3627abdfc751a593ab128c14adffd20d78ff913fe6d",
        "heading_samples": [
          "# accounting-korea Domain — 구조 명세",
          "## K-IFRS 재무제표 구조 필수 요소",
          "## K-GAAP 재무제표 구조 차이",
          "## 세무 신고 구조",
          "## 증빙 체계 구조",
          "## 전자공시 구조",
          "## 계정과목 체계",
          "## 내부회계관리제도 구조"
        ],
        "evidence_refs": [
          "general_domain:accounting-kr/structure_spec.md"
        ]
      }
    ],
    "local_domain_sources": [],
    "local_domain_boundaries": [
      {
        "id": "local_boundary:workbook_sample:3392b1854fec",
        "layer": "local_domain",
        "boundary_kind": "workbook_sample_boundary",
        "label": "mbp_2026년 02월_결제 및 수익인식F_260309.xlsx",
        "status": "review_required",
        "scope": "current_workbook_only_until_boundary_confirmed",
        "source_anchor": {
          "workbook_path": "/Users/kangmin/cowork/day1_revenue_ontology/input/reference/mbp_2026년 02월_결제 및 수익인식F_260309.xlsx",
          "workbook_sha256": "3392b1854fec1c8e634ceff36bd3d40e17f4dfc47bd47989ff08ebd7ae36f8f3",
          "workbook_file_name": "mbp_2026년 02월_결제 및 수익인식F_260309.xlsx"
        },
        "local_source_ids": [],
        "required_confirmation": [
          "organization_or_project_boundary",
          "local_policy_or_vocabulary_sources",
          "applicability_period_or_workbook_family"
        ],